,Company/Brand,Sector,Stage,Amount($),HeadQuarter,What it does,Founded,Founders,Investor,Unnamed: 9
2250,KreditBee,FinTech,Seed,8000000.0,Bengaluru,KreditBee is a digital lending platform developed to assist young professionals with their personal finances.,2018.0,"Karthikeyan Krishnaswamy, Madhusudan Ekambaram, Wan Hong","NewQuest Capital Partners, Motilal Oswal Private Equity",
2251,Spardha,Education,Series A,400000.0,Pune,"Spardha School Of Music, Spardha Academy, Spardha Online are associated marks with Spardha Learnings Private Limited.",2016.0,"Saurabh Srivastav, Amrita Srivastav",Inflection Point Ventures,
2252,Onelife Nutriscience,Healthcare,Seed,3500000.0,Mumbai,Onelife Nutriscience is a consumer healthcare brands company.,2019.0,Gaurav Aggarwal,Lasons India,
2253,Flatheads,Fashion,Seed,3500000.0,Bengaluru,Flatheads is a lifestyle brand that designs and creates shoes from India for the world. Flatheads launched India's first bamboo footwear.,2019.0,"Ganesh Balakrishnan, Utkarsh Biradar","Pankaj Chaddah, Srivatsan Rajan",
2254,Fable Fintech,FinTech,Series A,3500000.0,Mumbai,"Fable Fintech is being seed-funded by the CCAvenue Group, South East Asia’s number 1 eCommerce service provider",2015.0,Naushad Contractor,Paytm,
2255,Holisol,Logistics,Seed,3000000.0,Delhi,HoliSol Logistics Is a Supply Chain Operations Company!,2009.0,"Manish Ahuja, Naveen Rawat, Rahul Dogar","BlackSoil, CLSA Capital Partners",
2256,Now&Me,Healthcare,Seed,1000000.0,Delhi,"Now&Me is a safe cocoon in the form of discussion forums, for you to let out your most intimate thoughts.",2018.0,"Bani Singh, Drishti Gupta","Saama, Whiteboard Capital",
2257,Fyllo,AgTech,Seed,400000.0,Bengaluru,Fyllo brings farms on palms by installing on field devices and actions on top of this data.,2019.0,"Sudhanshu Rai, Sumit Sheoran","Indian Angel Network, Titan Capital, Lead Angels",
2258,Cora Health,Healthcare,Seed,3500000.0,Bengaluru,Social Commerce Marketplace for health and wellness. Help people discover products suited to their health needs.,2020.0,"Shrijit Venkatesh, Snigdha Kumar",Unknown,
2259,Blaer Motors,Mobile Phones,Seed,300000.0,Chennai,Meant to augment human power and not completely replace it,2014.0,Abinesh Ekambaram,The Chennai Angels,
2260,Swiflearn,Education,Series A,3000000.0,Gurugram,Swiflearn provides online tuition classes to small batches to ensure personalised learning.,2019.0,"Abhinav Agarwal, Anand Bakode","Venture Highway, Stellaris Venture Partners",
2261,Cashfree,FinTech,Seed,3500000.0,Bengaluru,Cashfree is a payments and banking technology company that enables businesses in India to collect payments online and make payouts.,2015.0,"Akash Sinha, Reeju Datta","State Bank of India, Y Combinator",
2262,QuickSell,E-Commerce,Series A,2000000.0,Mumbai,B2B Mobile Commerce Platform,2017.0,Deepak Bhagchandani,"Sanjay Baldwa, Ajay Jain",
2263,Truemeds,Helathcare,Series A,5000000.0,Mumbai,Truemeds is a health-tech startup.,2019.0,"Akshat Nayyar, Kunal Wani",InfoEdge,
2264,Candes,E-Commerce,Seed,3000000.0,Delhi,Candes is a home appliances company providing a complete range of home & kitchen electrical appliances at affordable prices.,2015.0,"Sandeep Aggarwal, Vipin Aggarwal","Nitin Passi, Ruchirans Jaipuria",
2265,MediBuddy,Helathcare,Seed,3000000.0,Bengaluru,"MediBuddy is a digital healthcare platform for inpatient hospitalization, outpatient services, and corporate wellness benefits.",2000.0,"Satish Kannan, Enbasekar","Stride Ventures, InnoVen Capital",
2266,F5,Catering,Series A,300000.0,Delhi,F5 is a foods and beverages company.,2018.0,"Lalit Aggarwal, Raghav Arora","Venture Catalysts, Jeevak Gupta",
2267,Capital Float,FinTech,Seed,6000000.0,Bengaluru,Capital Float is an online platform that provides working capital finance to SMEs in India.,2013.0,"Gaurav Hinduja, Sashank Rishyasringa","Triodos Investment Management, SAIF Partners",
2268,IntelleWings,IT,Seed,100000.0,Panchkula,"IntelleWings develops Sanctions & Anti-money laundering solutions with a clear, concise, and fresh perspective.",2019.0,Pramod Sharma,Unknown,
2269,Shyplite,Logistics,Seed,1000000.0,Delhi,Enable E-retailers to automate their logistics and increase efficiency in shipments by providing a single window shipping platform,2016.0,"Nisschal Jain,  Sugam Jain, Parinay Itkan",N+1 Capital,
2270,Refyne,FinTech,Series A,20000000.0,Bengaluru,Refyne partners with organisations to extend on-demand Earned Wage Access (EWA) to employees.,2020.0,"Chitresh Sharma, Apoorv Kumar","DST Global, RTP Global",
2271,Greenjoules,Energy,Series A,4500000.0,Pune,Greenjoules is a green energy technology startup that specializes in making renewable biofuels.,2018.0,"R. Sethunath, V S Shridhar, V. Radhika, Viraraghavan Sankaran",Blue Ashva Capital,
2272,MentorKart,Consulting,Seed,150000.0,Delhi,MentorKart™ helps to fulfil dreams and take that big step towards success.,2018.0,"Ashish Khare, SK Mohanty","Amit Singal, Manish Aggarwal",
2273,Leverage Edu,Education,Seed,2000000.0,Delhi,AI-enabled marketplace designed to help students with their higher education and career growth plans,2017.0,Akshay Chaturvedi,"Trifecta Capital Advisors, Blume Ventures",
2274,Kale Logistics,Logistics,Series A,5000000.0,Thane,Kale Logistics Solutions is a global IT solutions provider focused on providing cutting-edge technology solutions to the Logistics industry.,2010.0,"Amar More, Vipul Jain",Inflexor Ventures,
2275,CustomerGlu,ERP,Seed,320000.0,Bengaluru,CustomerGlu is a Low code Interactive Engagement platform to improve user stickiness.,2016.0,"Prateek Gupta, Raman Shrivastava, Sumant US","Kumar Aakash, Amit Singhal",
2276,Cell Propulsion,Environmental Consulting,Seed,2000000.0,Bengaluru,Cell Propulsion is a fleet electrification company developing solutions for large scale electrification of commercial vehicle fleets.,2016.0,"Nakul Kukar, Paras Kaushal",growX ventures,
2277,Wellbeing Nutrition,Healthcare,Seed,3500000.0,Mumbai,Organic whole food nutrition to keep up with the pace at which we live,2019.0,Avnish Chhabria,Klub,
2278,Pee Safe,Healthcare,Series B,3000000.0,Gurugram,Redcliffe Hygiene Private Limited is India's fastest growing hygiene company.,2013.0,"Dheeraj Jain, Srijana Bagaria, Vikas Bagaria","Shaival Desai, Alkemi Venture Partners",
2279,Chqbook,FinTech,Seed,1000000.0,Delhi,"Chqbook is a fintech startup that allows customers to explore, compare, book and get personal finance products.",2017.0,"Mohit Goel, Rajat Kumar, Sachin Arora, Vipul Sharma","Aavishkaar Venture Capital, YWC Venture Capital",
2280,SimpliContract,Software,Seed,1800000.0,Bengaluru,"SimpliContract is an Enterprise SaaS offering, focused on end to end Contract Life-cycle Management.",2020.0,"Guru Venkatesan, Jinaraj PG, Makesh Kumar",Kalaari Capital,
2281,Dropshop,Logistics,Series A,1000000.0,Bengaluru,Building technology to make distribution efficient and cheaper for large and small FMCG companies,2019.0,"Udit Dhawan, Rohit Fernandes, Ravi Teja",Inflection Point Ventures,
2282,Jumbotail,E-Commerce,Seed,4000000.0,Bengaluru,Jumbotail is an operator of an online marketplace that simplifies food and grocery shopping.,2015.0,"Ashish Jhina, Karthik Venkateswaran",Alteria Capital,
2283,BYJU'S,Education,Seed,350000000.0,Bengaluru,BYJU'S is an educational technology company that develops personalized learning programs for K-12 students.,2011.0,"Byju Raveendran, Divya Gokulnath","Tiga Investments, Baron Capital",
2284,Power Gummies,Healthcare,Seed,1000000.0,Delhi,Power Gummies are a team of passionate givers who are dedicated to catering nutritional supplements,2018.0,Divij Bajaj,"Venture Catalysts, 9unicorns",
2285,Convosight,Saas,Series A,9000000.0,Delhi,A mission - to help community builders become community entrepreneurs.,2019.0,Tarun Dhamija,Qualgro,
2286,Junio,FinTech,Seed,600000.0,Delhi,Junio is a kids-focused digital pocket money-smart card.,2020.0,Ankit Gera,"Amit Lakhotia, Pravin Jadhav",
2287,Wherehouse.io,Logistics,Seed,3500000.0,Delhi,"Wherehouse.io is a supply chain intelligence company, helping brands to move closer to their customers enabling faster and better deliveries and accelerating business growth.",2020.0,"Vaibhav Chawla, Jeevan Prakash, Lavelesh Sharma",Better Capital,
2288,Flexmoney,FinTech,Series A,4800000.0,Mumbai,"Flexmoney’s mission is to address the enormous digital credit market opportunity created by the disruption from e-commerce, EMI and BNPL checkout finance",2015.0,Yezdi Lashkari,Pravega Ventures,
2289,Fampay,FinTech,Series A,38000000.0,Bengaluru,India's first numberless card and UPI without a bank account,2019.0,"Kush Taneja, Sambhav Jain","Greenoaks Capital, Elevation Capital",
2290,Apna,Human Resources,Series B,70000000.0,Bengaluru,India's Professional App - Apna is dedicated to solving the problem of unemployment at the grassroot level,2019.0,Nirmit Parikh,"Sequoia Capital India, rocketship.vc",
2291,XYXX Apparels,Fashion,Series A,4000000.0,Surat,"XYXX Apparels,which runs an eponymous innerwear brand",2017.0,Yogesh Kabra,Unknown,
2292,WaterScience,E-Commerce,Seed,3500000.0,Bengaluru,The aim of making good water affordable and accessible.,2014.0,Sudeep N,Unknown,
2293,BrowserStack,Saas,Series B,200000000.0,Mumbai,BrowserStack is a leading software testing platform powering over two million tests every day across 15 global data centres.,2011.0,"Nakul Aggarwal, Ritesh Arora",Accel,
2294,Vital,Insurance,Series A,3000000.0,Delhi,"An affordable, digital health plan built around to cover both big and small expenses",2018.0,Rahul Kumar,BLinC Invest,
2295,Juicy chemistry,Healthcare,Seed,3500000.0,Coimbatore,Juicy Chemistry operates as an eponymous consumer brand.,2014.0,"Megha, Pritesh Asher",Spring Marketing Capital,
2296,Samaaro,Saas,Seed,125000.0,Bengaluru,"Samaaro is a virtual event platform designed to help organizations host scalable, secure, and effective virtual events for a global audience",2020.0,"Mayank Banka, Purnank Prakash, Skandha Gopalan","Chaitanya Kalipatnapu, Kedar Gavane",
2297,Imagimake,Creative Agency,Series A,500000.0,Mumbai,An innovative play system to help children create their imagination,2011.0,"Disha Katharani, Ravi Kumar","Roha Investment Managers, angel investor Saumil Shah",
2298,MSMEx,Education,Series A,1000000.0,Andheri,MSMEx connects micro and small Business Owners with curated Business Experts over live video.,2019.0,"Amit Kumar, Vishal Kumar, Dilip Kumar, Khushboo Arora, Kumar Sambhav","TNF Ventures, Razorpay",
2299,RenewBuy,Insurance,Series C,45000000.0,Gurugram,Simplest way to renew car insurance. Get quote and insure car in couple of minutes,2015.0,"Balachander Sekhar, Sandeep Nanda","Lok Capital, IIFL Asset Management",
2300,saarthi.ai,AI,Seed,3500000.0,Bengaluru,Multilingual Conversational Enterprise AI Platform for omnichannel automation of customer journeys in the user's native language.,2017.0,"Piyush Dangaich, Sameer Sinha, Sangram Sabat, Vishwa Nath Jha",Nvidia Inception,
2301,Kutumb,Digital Media,Series A,26000000.0,Bengaluru,Kutumb is a social community enabler.,2020.0,"Mohit Sharma, Naveen Dewangan, Vipul Allawadhi","Tiger Global Management, DST Global",
2302,Superplum,AgTech,Series A,3800000.0,Noida,Building India's most sophisticated platform for high quality fresh food,2019.0,Shobhit Gupta,Marquee investors,
2303,Upside AI,FinTech,Seed,1200000.0,Mumbai,Upside AI on the thesis that technology will make better investing decisions than humans over the long term.,2017.0,"Kanika Agarrwal, Nikhil Hooda, Atanuu Agarrwal",Endiya Partners,
2304,PazCare,Insurance,Seed,3500000.0,Bengaluru,Paz Care is India's leading Employee Benefits & Health insurance platform,2021.0,Sanchit Malik,"Ashish Hemrajani, Parikshit Dar",
2305,Answer Genomics,Healthcare,Seed,3500000.0,Bengaluru,A healthcare company that uses genome-based data to help individuals make decisions.,2019.0,Rahul Ranganathan,"India Accelerator, Lyxel&Flamingo",
2306,Skillmatics,Education,Series A,6000000.0,Mumbai,Skillmatics develops learning games for pre-school and primary school kids aged under 10,2016.0,Dhvanil Sheth,Sequoia Capital India,
2307,Bimaplan,Insurance,Series A,2500000.0,Bengaluru,Affordable insurance for the next billion Indians,2020.0,Vikul Goyal,"Roshan Abbas, Ritesh Malik",
2308,Bueno Finance,FinTech,Seed,3000000.0,Gurugram,"Bueno Gig Growth Technologies Pvt Ltd (""Bueno Finance"") is a financial services platform which aims is to help improve the financial health of customers.",2019.0,"Saurav Gandhi, Sandeep Arora","Goat Capital, JAM Fund",
2309,CityMall,E-Commerce,Series B,22000000.0,Gurugram,CityMall is a social e-commerce platform that sells lifestyle and curated products via peer-to-peer referrals on WhatsApp.,2019.0,"Angad Kikla, Naisheel Verdhan","General Catalyst, Jungle Ventures",
2310,BYJU’S,Education,Seed,50000000.0,Bengaluru,BYJU'S is an educational technology company that develops personalized learning programs for K-12 students.,2011.0,"Byju Raveendran, Divya Gokulnath","Blackstone Group, ADQ",
2311,India Quotient,Finance,Seed,64000000.0,Mumbai,India Quotient is a new type of early stage investor. We fund companies building disruptive businesses aimed at Indian consumers. We're,2012.0,"Anand Lunia, Madhukar Sinha",Unknown,
2312,The Switch Fix,Healthcare,Seed,3500000.0,Gurugram,The Switch Fix is a plant-based clean and conscious personal care brand for young urbans.,2019.0,"Abhishek Kumar, Rhea Shukla","Venture Catalysts, 9unicorns",
2313,Anvidha Technologies,IT,Seed,1500000.0,Haryana,Anvidha Technologies Private Limited is a HARYANA based private ltd.,2020.0,Ganesh ranganathan iyer,Unknown,
2314,DigiSparsh,FinTech,Seed,3500000.0,Mumbai,DigiSparsh is India's first and only healthcare fintech platform which aims to make healthcare facilities accessible to everyone in the country.,2020.0,"Saurabh Soni, Akhilesh Gandhi",GoAhead Ventures,
2315,CoffeeMug.ai,IT,Seed,620000.0,Delhi,"A video first global platform of senior professionals, connecting 1:1, virtually or over coffee, building a powerful, long-lasting relationship.",2020.0,"Abhishek Sharma, Dipti Tandon","Paradigm Shift Capital, AngelList India",
2316,Pathfndr.io,Saas,Series A,3500000.0,Bengaluru,Intelligent Travel Tech Stack making sense of the world's information by scanning billions of data points and ranking destinations,2015.0,Varun Gupta,Arali Ventures,
2317,BigLeap,Human Resources,Seed,600000.0,Hyderabad,BigLeap Technologies & Solutions is focused on providing viable offshore consultancy services for enterprises looking to grow their business.,2015.0,"Jamesh Johnson, Sainath Malkapuram Goud",Anup Kumar Yama,
2318,Kazam,Environmental Consulting,Seed,900000.0,Bengaluru,"Kazam provides end to end Electric Vehicle charging solutions for Office Spaces, Apartments, Restaurants, Shops",2020.0,"Akshay Shekhar, Vaibhav Tyagi",Inflection Point Ventures,
2319,MYRE Capital,Real Estate,Seed,6000000.0,Mumbai,Democratising Real Estate Ownership,2020.0,Own rent yielding commercial properties,Aryaman Vir,
2320,BimaPe,FinTech,Seed,500000.0,Mumbai,BimaPe demystifies Insurance and its Management for individuals and families across India. 'BimaPe Bharosa Karo',2020.0,Rahul Mathur,"iSeed, Titan Capital",
2321,MicroDegree,Education,Seed,3500000.0,Bengaluru,MicroDegree is an ed-tech platform working towards democratising technology and job ready skills for Bharat.,2019.0,"Gaurav Kamath, Rakesh Kothari, Manikanta Nair",Research Innovation Incubation Design Labs,
2322,Saarthi Pedagogy,Education,Seed,1000000.0,Ahmadabad,"India's fastest growing Pedagogy company, serving to school as an academic growth partner and provide 360° solutions to schools on Academic Strategies",2015.0,Pedagogy,Sushil Agarwal,
2323,Synapsica,Healthcare,Series A,4000000.0,Delhi,Artificial Intelligence tools to make quality diagnostic assessment available for all.,2017.0,"Meenakshi Singh, Dr Cherian, Kuldeep Singh Chauhan","IvyCap Ventures, Endiya Partners",
2324,Kwik Foods,Catering,Seed,3500000.0,Gurugram,Kwik Foods is one of the fastest-growing D2C fresh food brands that is disrupting the food industry,2020.0,"Prabhleen Kaur, Harshal Patel",9Unicorns,
2325,Plutomen,IT,Seed,300000.0,Ahmadabad,Plutomen Technologies Pvt Ltd founded in Nov 2016 is recognized start-up by DIPP in the field of Emerging Technology.,2016.0,Keyur Bhalavat,"GUSEC Seed Fund, DeVX Venture Fund",
2326,GoMechanic,Automotive,Series C,42000000.0,Gurugram,"GoMechanic is India’s leading multi-brand car service company, committed to making the car servicing experience hassle-free & easy for everyone.",2016.0,Kushal Karwa,"Tiger Global, Sequoia",
2327,Grinntech,Automotive,Seed,2000000.0,Chennai,"Grinntech is an investor backed, growth phase start-up, leading on all front of battery design for EV applications.",2013.0,"Nikhilesh Mishra, Puneet Jain",Unknown,
2328,Nobel Hygiene,Healthcare,Seed,60000000.0,Mumbai,"Nobel Hygiene is one of the leading disposable hygiene care products manufacturer in the country with an ISO 9001:2015 and CE certification, headquartered in Mumbai.",1999.0,Johari Kamal,Quadria Capital,
2329,Green Cure,Healthcare,Series A,3500000.0,Delhi,World's first company to combine German Engineering with Indian Ayurveda in health products,2015.0,Sanchit Garg,Venture Catalysts,
2330,Classplus,Education,Series C,65000000.0,Noida,Classplus was born out of an urge to redefine classroom engagement in this country.,2017.0,"Mukul Rustagi, Bhaswat Agarwal",Tiger Global,
2331,WINDO,E-Commerce,Seed,500000.0,Hyderabad,Convert Instagram Page Into an Online Store in under 2-minutes. Create a free online store and automate your sales.,2020.0,"Silus Reddy Chintapalli, Rakesh Vaddadi",Unicorn India Ventures,
2332,ApnaKlub,E-Commerce,Series A,3500000.0,Bengaluru,Supporting independent businesses and retail entrepreneurs with better than market wholesale prices and supply chain.,2020.0,"Shruti, Manish Kumar","Blume Ventures, Whiteboard Capital",
2333,LegalPay,FinTech,Seed,3500000.0,Delhi,A tech focused B2B litigation finance company in India.,2019.0,Kundan Shahi,Ashwini Kakkar. 9Unicorns,
2334,Lavado,Customer Service,Seed,3500000.0,Mumbai,A startup that is trying to permanently change the way people approach the cleaning and maintenance of their apparel and accessories.,2016.0,Disha Jain,Ashish Shah,
2335,Navars,Education,Seed,3500000.0,Hyderabad,"Navars Edutech comprises dynamic mix of intellectual professionals, managerial team, Subject matter experts and Astronomy and Space researchers.",2019.0,Sravan Varma Datla,Faad Network,
2336,GoBolt,Logistics,Series B,20000000.0,Gurugram,"GoBOLT is a tech-logistics company operating in Line Haul & Short Haul Trucking, creating value through dis-intermediation, increased asset utilization and extensive use of technology.",2015.0,"Naitik Baghla, Parag Aggarwal, Sumit Sharma","Paragon Partners, Aavishkaar Capital",
2337,Loco,Gaming,Seed,9000000.0,Bengaluru,Loco is India's leading live game streaming app.,2018.0,"Anirudh Pandita, Ashwin Suresh","Krafton, Lumikai",
2338,Auric,Healthcare,Series A,2000000.0,Delhi,Contemporary Beauty & Wellness Brand Based on Ayurveda,2017.0,Deepak Agarwal,Venture Catalysts,
2339,Edmingle,Education,Seed,300000.0,Bengaluru,Edmingle is a platform for all educators who want to launch their courses and sell them online.,2016.0,Gaurav Doshi,"Indovation Fund, Mumbai Angels",
2340,Slice,FinTech,Seed,20000000.0,Bengaluru,"Slice is India's best credit card challenger to pay bills, manage expenses, and unlock rewards.",2016.0,Rajan Bajaj,"Gunosy, Blume Ventures",
2341,Humit,Music Streaming,Seed,3500000.0,Bengaluru,Humit is a social networking app for music sharing and discovery.,2020.0,"Rohit Ganapathy, Prithvi Sankar, Ishaan Negi",Antler India,
2342,Airblack,IT,Series A,5200000.0,Gurugram,Airblack is on a mission to help people convert their passion to a livelihood.,2019.0,"Videt Jaiswal, Vaibhav Raj Gupta","Edge Ventures, Elevation Capital",
2343,NIRAMAI,Healthcare,Seed,3500000.0,Bengaluru,"NIRAMAI has developed a novel breast cancer screening solution that uses Thermalytix, i.e. machine intelligence over thermography images.",2016.0,Geetha Manjunath,CDC Group,
2344,Intervue,Saas,Seed,3500000.0,Delhi,World's fastest collaborative environment to take tech interviews.,2021.0,"Rahul Arora, Pushpender Singh Rautela","Titan Capital, Kunal Shah",
2345,Nestroots,Fashion,Seed,100000.0,Gurugram,"Ottoman, Stool, Brass Kitchen Solutions, Masala Box, Roti Box, Bar Accessories and Many Gifting Options at Nestroots.",2016.0,Chhavi Singh,We Founder Circle,
2346,Detect Technologies,Automotive,Seed,12000000.0,Chennai,Detect Technologies is a leading Industrial AI company that is building innovative solutions and cutting-edge technology for the industrial ecosystem.,2016.0,Daniel Raj David,"Accel Partners, Elevation Capital",
2347,CredR,Automotive,Seed,6500000.0,Bengaluru,CredR is India’s Most Trusted Used Two-Wheeler Consumer Brand that leverages Technology & Processes to simplify the Used Two-wheeler Market.,2015.0,Sasidhar Nandigam,"Yamaha Motors, Omidyar Network India, Eight Roads Ventures",
2348,Fourth Partner Energy,Energy,Seed,125000000.0,Hyderabad,"Fourth Partner Energy is India’s leading distributed solar energy firm focusing on building and financing solar projects across the private and public sectors for commercial, industrial and institutional entities.",2010.0,Vivek Subramanian,"Norfund, The Rise Fund",
2349,TABLT,Healthcare,Series A,3000000.0,Kolkata,TABLT [Previously Sabse Sasta Dukaan] is one of India's most trusted online pharmacy dealing in medicines and other healthcare products.,2018.0,Anish Agarwal,Siti Cable,
2350,Hesa,IT,Seed,2000000.0,Hyderabad,HESA is connecting Bharat with India and India with Bharat Phygitally. We are bridging the gap for the world’s largest customer base that resides in rural India.,2020.0,"Vamsi Udayagiri, Hema Nandiraju","Venture Catalysts, 9unicorns",
2351,Powerhouse91,Consumer Goods,Seed,3500000.0,Gurugram,"A tech-driven company that acquires, operates, and scales outstanding ecommerce brands in India.",2020.0,"Shashwat Diesh, Aqib Mohammed",Crossbeam Venture Partners,
2352,Nalanda Learning,Education,Seed,5000000.0,Kolkata,India's 1st Online Preschool with Blended Learning Model,2011.0,Tamal Mukherjee,Aavishkaar Capital,
2353,Chargeup,Energy,Series A,3500000.0,Delhi,"""Battery as a Service"" for 3 wheeler & 2 wheelers",2019.0,"Varun Goenka, Akshay Kashyap",Mapmyindia,
2354,Knackit,IT,Seed,100000.0,Bengaluru,Knackit is a talent sharing platform where users can showcase and monetize their artistry.,2019.0,"Pranjal Kumar, Akanksha Bhardwaj",Jyoti Bansal,
2355,Treebo Hotels,Hospitality,Series D,16000000.0,Bengaluru,Treebo Hotels is India's most loved hotel chain in the premium-budget segment.,2015.0,"Sidharth Gupta, Kadam Jeet Jain, Rahul Chaudhary",Accor,
2356,Raptee Energy,Automotive,Seed,700000.0,Chennai,Raptee Energy Inc. is looking to accelerate the transition to smart and sustainable mobility!,2019.0,Phunith Kumar,Unknown,
2357,Meddo,Healthcare,Seed,6000000.0,Gurugram,Meddo (Arctern Healthcare) are re-defining how primary and secondary healthcare is provided in India through a connected care delivery platform.,2018.0,"Saurabh Kochhar, Dr Naveen Nishchal","SRI Capital, Picus Capital, Alkemi Capital",
2358,Supertails,Veterinary,Series A,2600000.0,Bengaluru,Supertails is building a digital pet care platform which offers expert led healthcare services and products.,2021.0,"Vineet Khanna, Varun Sadana, Aman Tekriwal","Saama Capital, DSG Consumer Partners",
2359,SkilloVilla,Education,Seed,300000.0,Bengaluru,Mission to support young graduates in enhancing their learnings and transform them into big earnings.,2020.0,"Ronak Agrawal, Rajat Agrawal, Deepak Kharol",Titan Capital,
2360,Cancer Clinics,Healthcare,Series A,1500000.0,Telugana,"Cancer Helpline is a source of information and support, helping with all the things that people affected by cancer want and need.",2014.0,"Sonali Srungaram, Sasi Sunkara",Axilor,
2361,Velocity,FinTech,Seed,1300000.0,Bengaluru,Velocity provides revenue-based-financing to online businesses. It aims to build the future of banking and financial services for new age businesses in India.,2020.0,"Abhiroop Medhekar, Atul Khichariya, Saurav Swaroop",Valar Ventures,
2362,Happy Jars,Catering,Seed,400000.0,Delhi,"Manufacture and retail a delicious range of all-natural nut butters, made without oil, sugar or preservatives.",2016.0,"Surabhi Talwar, Vikram Sekhar",Inflection Point Ventures,
2363,Inshorts,Media and Entertainment,Seed,40000000.0,Noida,Inshorts is a news aggregator application that collects and summarizes news based on user behavior and preferences.,2013.0,"Anunay Pandey, Azhar Iqubal, Deepit Purkayastha","Addition, SIG Global India Fund",
2364,ExtraaEdge,Manufacturing,Series A,1000000.0,Pune,Data Science powered - Admission & Marketing CRM Automation for Education Enrolments,2015.0,"Abhishek Ballabh, Sushil Mundada","9Unicorns Accelerator Fund, Indian Angel Network",
2365,Zotalabs,IT,Seed,1250000.0,Pune,Zotalabs gives the power of Emerging Technology to your digital automation with our easy to use APIs.,2019.0,"Nausherwan Shah, Wasim Khan",Alfa Ventures,
2366,Voiro,Advertisement,Series A,1800000.0,Bengaluru,Voiro is the first all-in-one revenue management suite exclusively for ad-led digital publishers across media.,2014.0,"Anand Gopal, Kavita Shenoy",1Crowd,
2367,Dream Sports,Gaming,Seed,400000000.0,Mumbai,"Dream Sports is India’s leading sports technology company with brands such as Dream11, FanCode, DreamX and DreamSetGo in its portfolio.",2008.0,"Bhavit Sheth, Harsh Jain","TCV, D1 Capital Partners, Falcon Edge.",
2368,Safex Chemicals,AgTech,Seed,50000000.0,Delhi,Safex Chemicals India Ltd is a leading company having a strong foothold in the Indian agrochemicals industry.,1991.0,"SK Jindal, SK Chaudhary",BanyanTree Finance Pvt. Ltd.,
