,Company/Brand,Sector,Stage,Amount($),HeadQuarter,What it does,Founded,Founders,Investor,Unnamed: 9
1492,Josh Talks,Media and Entertainment,Series A,1500000.0,Haryana,Community of young individuals providing a platform to showcase their stories,2020.0,"Supriya Paul, Shobhit Banga",Media Development Investment Fund,
1493,PhoneParLoan,FinTech,Seed,0.0,Delhi,Provides easy loans,2020.0,Ringaile Noq,Accelerator MOX,
1494,RailYatri,Transportation,Seed,13800000.0,Noida,A complete Indian railways app,2020.0,"Manish Rathi, Kapil Raizada, Sachin Saxena","Nandan Nilekani, Samsung Venture Investment Corporation",
1495,AjnaLens,AI,Series A,1500000.0,Thane,"It leverages technologies such as AR, VR & AI to offer hardware in areas such as education and defence",2020.0,"Pankaj Raut, Abhishek Tomar, Abhijit Patil","Maharashtra Defence, Aerospace Venture Fund (MDAVF)",
1496,Pepper,Advertising,Seed,306900.0,Mumbai,End to end content creation platform,2020.0,Anirudh Singla and Rishabh Shekhar,"Kunal Bahl, Rohit Bansal",
1497,Rupeek,FinTech,Seed,30000000.0,Bengaluru,An asset backed online lending platform,2020.0,"Amar Prabhu, Ashwin Soni, Sumit Maniyar","GGV Capital, Bertelsmann India Investments, Binny Bansal, Sequoia India, Accel Partners",
1498,iMerit,IT,Series B,20000000.0,Kolkata,Turns information into data that is usable for machine learning processes,2020.0,Radha Basu,CDC Group Plc,
1499,BharatPe,FinTech,Series C,75000000.0,Delhi,Digital payments platform,2020.0,Ashneer Grover,Ribbit Capital,
1500,Invideo,Media and Entertainment,Seed,2500000.0,Delhi,Video production and editing platform,2020.0,Sanket Shah,Sequoia Capital’s Surge,
1501,AvalonMeta,EdTech,Seed,420000.0,Delhi,It combines higher education and competitive gaming,2020.0,"Varun Mayya, Shashank Udupa, Abhinav Arora",Peerplays,
1502,Near Store,E-Commerce,Seed,300000.0,Mumbai,Enables a shop to create an online presence,2020.0,Seed,Sauce.vc,
1503,ElecTorq,Automotive,Seed,0.0,Delhi,Electric vehicle startup,2020.0,Anubhav Sharma,AdvantEdge,
1504,Prayaan Capital,FinTech,Seed,1200000.0,Chennai,"NBFC that lends to micro, small, and medium-sized enterprises (MSMEs)",2020.0,"Madhan Mohan , Akash Chelvam",Accion Venture Lab,
1505,Sanfe,CleanTech,Series A,1100000.0,Delhi,Women health care and wellness product,2020.0,"Archit Agarwal, Harry Sehrawat","SucSEED Venture Partners, BIRAC, Elixir Pharma, Titan Capital",
1506,Go Desi,Catering,Seed,627300.0,Delhi,Provides traditional delicacies,2020.0,Vinay Kothari,Rukam Capital,
1507,Swiggy,Catering,Series A,113000000.0,Bengaluru,Platform to order food online from restaurants and getting it delievered,2020.0,"Nandan Reddy, Sriharsha Majety, Rahul Jaimini",Prosus N.V,
1508,Whatfix,SaaS,Series C,32000000.0,Bengaluru,"Digital adoption platform that helps companies provide intuitive onboarding, training and support",2020.0,"Khadim Batti, Vara Kumar",Sequoia Capital India,
1509,Unacademy,EdTech,Series E,110000000.0,Bengaluru,Platform that offers online education in India,2020.0,"Gaurav Munjal, Roman Saini, Hemesh Singh","Facebook, General Atlantic, Sequoia India, Nexus Venture Partners, Steadview Capital, Blume Ventures",
1510,Zvesta,Facilities Support Services,Seed,5500000.0,Gurugram,An online platform where users can search and buy properties listed by developers and brokers,2020.0,"Rajan Dang, Anushree Srivastava",Hindustan Media Ventures,
1511,Dunzo,Logistics,Seed,11000000.0,Bengaluru,India-based hyperlocal delivery startup,2020.0,Kabeer Biswas,Alteria Capital,
1512,Digit Insurance,Insurance,Seed,340000.0,Bengaluru,General Insurance Company,2020.0,Kamesh Goyal,"Virat Kohli, Anushka Sharma",
1513,Yolo,Transportation,Seed,600000.0,Gurugram,Intercity transportation,2020.0,"Shailesh Gupta, Mukul Shah, Danish Chopra",Undisclosed,
1514,SmartVizX,Saas,Series A,1397000.0,Delhi,It developed India’s first VR-based design communication and collaboration product Trezi,2020.0,"Tithi Tewari, Gautam Tewari",Rockstud Capital,
1515,MaxWholesale,E-Commerce,Series A,3000000.0,Delhi,B2B ecommerce platform for kirana stores,2020.0,Samarth Agrawal,"IAN Fund-I,  Al Falaj Investment Company (AFI)",
1516,Carbon Clean,CleanTech,Seed,16000000.0,Delhi,Develops affordable carbon capture technology,2020.0,"Aniruddha Sharma, Prateek Bumb","WAVE Equity Partners, Chevron Technology Ventures, Marubeni Corporation.",
1517,Onsitego,Business Development,Series B,19000000.0,Delhi,It offers post-purchase services through a network of brand authorised service centres throughout the country,2020.0,Mahipal,Zodius Growth Fund,
1518,Genius Corner,EdTech,Seed,250000.0,Noida,Framework to enable personalised learning using artificial intelligence (AI) and machine learning (ML).,2020.0,"Vishal Khatter, Dheeraj Khatter, Dipak Varshney","Mahesh Mohta, Jyoti Arora, Nachu Subramanian, Srivats",
1519,PlanetSpark,EdTech,Seed,448500.0,Gurugram,Provides neighbourhood learning zones where children learn and develop 'new-age' skills under one roof,2020.0,"Maneesh Dhooper, Kunal Malik","Indian Angel Network, Lead Angels, Hyderabad Angels",
1520,CamCom,AI,Seed,0.0,Bengaluru,AI automation platform for enterprise quality control,2020.0,"Ajith Nayar, Umesh, Mahesh Subramanian","Triton Investment Advisors,",
1521,Simsim,E-Commerce,Series B,8000000.0,Bengaluru,It enables community opinion influencers to sell products to thousands of micro-communities in India,2020.0,Amit Bagaria,"Accel Partners, Shunwei Capital, Good Capital",
1522,Shuttl,Transportation,Series C,7975700.0,Delhi,App based bus aggregator serice,2020.0,"Amit Singh, Deepanshu Malviya",SIG Global India Fund,
1523,HooLiv,Real Estate,Seed,0.0,Delhi,Student Co-living startup,2020.0,"Chinmoy Mishra, Gaurav Vij, and Abhishek Verma",Kolte-Patil Family Office,
1524,ClassMonitor,EdTech,Seed,0.0,Indore,The learning platform that blends curriculum-based activities for children,2020.0,"Vijeet Pandey, Vikas Rishishwar",Ashwin Khorana,
1525,Friyey,Human Resources,Seed,0.0,Pune,Co working space startup,2020.0,Yogesh Thore,Tarun Bhalla,
1526,Oga,Fitness,Seed,330000.0,Bengaluru,Provides interactive fitness experience to people across the world,2020.0,Ashish Rawat,Inflection Point Ventures,
1527,Big Basket,E-Commerce,Seed,3500000.0,Bengaluru,Online grocery store,2020.0,"Abhinay Choudhari, Hari Menon, Vipul Parekh, VS Sudhakar",Trifecta Capital,
1528,CYFIRMA,SaaS,Series A,0.0,Bengaluru,Offer cybersecurity services,2020.0,Ritesh Kumar,Z3 Partners,
1529,Innoviti,Unknown,Seed,5000000.0,Bengaluru,Digital payments solutions company,2020.0,Rajeev Agrawal,FMO,
1530,Paytm money,FinTech,Seed,5600000.0,Bengaluru,Wealth Management,2020.0,Vijay Shekhar Sharma,One97 Communications,
1531,Vedantu,EdTech,Series C,24000000.0,Bengaluru,Onine learning platform,2020.0,"Saurabh Saxena, Pulkit Jain, Anand Prakash, Vamsi Krishna",GGV Capital,
1532,Yap,FinTech,Seed,1402000.0,Chennai,Banking and payment products-focused API platform,2020.0,"Madhusudanan R, Muthukumar and Prabhu","Amrish Rau, Kunal Shah, Jitendra Gupta",
1533,Clover,AgTech,Series A,5500000.0,Bengaluru,Provides agricultural solution to farmers working in the greenhouse production of vegetables and fruits,2020.0,"Avinash BR, Gururaj Rao, Arvind Murali, Santhosh Narasipura","Omnivore, Accel Partners, Mayfield",
1534,Nova Credit,FinTech,Series B,50000000.0,Delhi,Cross-border consumer credit startup,2020.0,Nicky Goulimis,"Kleiner Perkins, Canapi Ventures, Index Ventures, Nyca Partners, General Catalyst.",
1535,CodingNinjas,EdTech,Series A,5200000.0,Delhi,Online learning platform,2020.0,"Singla, Kannu Mittal, Dhawal Parate",Info Edge Ltd,
1536,Furlenco,E-Commerce,Series C,2200000.0,Bengaluru,Furniture rental startup,2020.0,Ajith Mohan Karimpana,Chowdry Associates,
1537,Brick&Bolt,Unknown,Series A,1500000.0,Bengaluru,Operates in the residential construction space,2020.0,"Jayesh Rajpurohit, Arpit Rajpurohit",Surge,
1538,HempStreet,Healthcare,Series A,1000000.0,Delhi,Manufacturer of ayurvedic medicines based on cannabis,2020.0,Abhishek Mohan,Pharmacon Holdings,
1539,MoEngage,Advertising,Series C,25000000.0,Bengaluru,Customer analytics and cross-channel engagement platform,2020.0,"Raviteja Dodda, Yashwanth Kumar",Eight Roads Ventures,
1540,Classplus,EdTech,Series A,2500000.0,Delhi,It allows coaching centres to take their brick-and-mortar setup online,2020.0,"Rustagi, Bhaswat Agarwal","Blume Ventures, Sequoia",
1541,Chaayos,Catering,Seed,21500000.0,Delhi,Provides customised range of tea,2020.0,"Nitin Saluja, Raghav Verma",Think Investment,
1542,PetPooja,SaaS,Seed,2000000.0,Ahmedabad,Restaurant management software provider,2020.0,Apurv Patel,Udaan,
1543,Altor,IT,Seed,0.0,Delhi,Makes helmets that are IoT and AI enabled,2020.0,"Shamik Guha, Sayan Tapadar, Muhammad Bilal Shakil, Anirban Datta Gupta",Venture Catalysts,
1544,Pepperfry,E-Commerce,Series F,40000000.0,Mumbai,Online home furniture marketplace,2020.0,"Ambareesh Murty, Ashish Shah",Pidilite Industries,
1545,FirstCry,E-Commerce,Series E,296000000.0,Pune,Baby products marketplace,2020.0,"Supam Maheshwari, Amitava Saha",Softbank’s Vision Fund,
1546,Byju,EdTech,Seed,200000000.0,Delhi,Provides online learning classes,2020.0,Byju Raveendran,General Atlantic,
1547,Waycool,AgTech,Series C,32000000.0,Chennai,Food development and distribution services,2020.0,Karthick Jayraman and Sanjay Dasari,LightBox Ventures,
1548,WorkIndia,Human Resources,Seed,6000000.0,Delhi,An online and mobile-based platform that connects companies with blue collar employees.,2020.0,Kunal Patil,Xiaomi,
1549,Qyuki,Media and Entertainment,Seed,3500000.0,Mumbai,Multi-channel broadcast network,2020.0,"AR Rahman, Shekhar Kapur",Info Edge Venture Fund,
1550,Leap India,AgTech,Series B,30000000.0,Coimbatore,Agricultural warehousing and logistics company,2020.0,Narain Karthikeyan.,Neev Fund,
1551,Picxy,Media and Entertainment,Seed,250000.0,Hyderabad,Stock photo industry,2020.0,Jitendra Emmani,"FirstCheque, Angellist India, Aakrit Vaish, Ranjith Radhakrishnan",
1552,Krimanshi,AgTech,Seed,20000.0,Jodhpur,Sustainable system to feed animals by valorizing food residues and surplus into highly nutritious feeds,2020.0,Nikhil Bohra,Arunachal Pradesh Social Entrepreneurship Meet,
1553,NEETprep,EdTech,Seed,0.0,Delhi,Provides crash course for NEET preparation,2020.0,Kapil Gupta,IndiaQuotient,
1554,Dot Pvt. Ltd,FinTech,Seed,8000000.0,Gurugram,It provides digital transformation and commerce solutions to brick and mortar outlets,2020.0,Shailaz Nag,"PayU, Fosun RZ Capital",
1555,Kuku FM,Media and Entertainment,Series A,5500000.0,Mumbai,A podcast platform,2020.0,"Lal Chand Bisu, Vikas Goyal, Vinod Kumar Meena",Vertex Ventures,
1556,SuperMoney,FinTech,Series A,1000000.0,Mumbai,Provides financial tools for effective business making,2020.0,Nikhil Banerjee,Unitus Ventures.,
1557,Rebel Foods,Catering,Seed,4900000.0,Delhi,It runs internet kitchen,2020.0,"Jaydeep Barman, Kallol Bannerjee",Alteria Capital,
1558,AlphaVector,E-Commerce,Seed,0.0,Bengaluru,It sells modern age bicycles named FROG,2020.0,Sachin Chopra,"Avaana Capital, Titan Capital",
1559,Fox Capital,FinTech,Seed,2500000.0,Jaipur,Digital lending startup,2020.0,Rakesh Sharma,Institutional Investors,
1560,Tribe Theory,Real Estate,Seed,3500000.0,Bengaluru,An entrepreneur-focused hostel chain present in multiple locations across the world.,2020.0,Katie Russel and Daniel Wiegand,Tim Draper,
1561,Fleetx,SaaS,Series A,1402400.0,Delhi,Fleet management and predictive analytics platform,2020.0,"Vineet Sharma, Abhay Jeet Gupta, Udbhav Rai, Parveen Kataria, Vishal Misra",Beenext,
1562,Embibe,EdTech,Seed,12618300.0,Mumbai,It provides AI-based data analytics to personalise learning outcomes,2020.0,Aditi Avasthi,Reliance Industries Limited (RIL),
1563,Entri,EdTech,Seed,1400000.0,Kochi,It is a app that provides different types of learning content in local languages,2020.0,"Mohammed Hisamuddin, Rahul Ramesh",Good Capital,
1564,Oye! Rickshaw,Mobile Payment,Series A,10000000.0,Delhi,App-based electric rickshaw hailing service,2020.0,Akash Deep,Chiratae Ventures,
1565,Seal Professional,EdTech,Series A,0.0,Bengaluru,Trains students in managemnt and leadership skills and also helps in placement,2020.0,Seed,Equanimity Ventures,
1566,Sprinng Foods,Catering,Seed,0.0,Mumbai,Provides Gluten-free food,2020.0,Tarun Khanna,"Mistletoe, Info Edge Asia",
1567,1MG,Healthcare,Seed,9900000.0,Gurugram,Online pharmacy,2020.0,"Prashant Tandon, Gaurav Agarwal, Vikas Chauhan",Bill & Melinda Gates Foundation,
1568,Aagey,FinTech,Seed,0.0,Bengaluru,Provides financial assistance to MSMEs,2020.0,Akaash Shankar,"JITO Angel Network, Ketan Kothari, Girish Jain, Sunil Singhvi, Vinay Jain",
1569,Doubtnut,EdTech,Series A,15000000.0,Gurugram,Multi-lingual digital solutions platform for students,2020.0,"Tanushri Nagori, Aditya Shankar",Tencent,
1570,AdonMo,Advertising,Seed,3000000.0,Bengaluru,It is an online and outdoor advertising company,2020.0,"Sandeep Bommireddi, Sravanth Gajula",Ant Financial,
1571,RACEnergy,Mobile Payment,Seed,0.0,Delhi,It builds electric vehicles and supporting infrastructure,2020.0,"Arun Sreyas, Gautham Maheswaran","GrowX ventures, Prophetic Ventures",
1572,BharatPe,FinTech,Seed,100000000.0,Delhi,Digital payments platform,2020.0,Ashneer Grover,Coatue Management,
1573,Kisan Network,AgTech,Seed,3000000.0,Gurugram,Integrated supply chain for farmers to sell their produce directly to buyers,2020.0,"Aditya Agarwalla, Sanjay Agarwalla",Atsushi Taira,
1574,Vogo,Automotive,Series C,35000000.0,Bengaluru,A scooter-sharing platform allowing users to rent a two-wheeler from specific designated pick up points,2020.0,"Anand Ayyadurai, Padmanabhan Balakrishnan, Sanchit Mittal",Lightstone Aspada,
1575,Yolo,Transportation,Seed,600000.0,Gurugram,Intercity transportation startup,2020.0,"Shailesh Gupta, Mukul Shah, Danish Chopra",Undisclosed,
1576,Unotech,SaaS,Seed,2000000.0,Mumbai,It develops fully-customisable open source software,2020.0,Vikash Jha,Manish Choksi,
1577,Zetwerk,Advertising,Seed,2200000.0,Bengaluru,B2B marketplace that connects manufacturing companies for industrial equipements,2020.0,"Amrit Acharya, Srinath Ramakkrushnan, Vishal Chaudhary",InnoVen capital,
1578,CureSkin,Healthcare,Seed,500000.0,Bengaluru,Provides a treatment solution for skincare and hair fall issues with an artificial intelligence-enabled solution,2020.0,"Guna Kakulapati, Rama Rajanna, Charu Sharma",SenseAI Ventures,
1579,WizKlub,EdTech,Seed,982530.0,Bengaluru,Helps students solve problems at complex level,2020.0,Amit Bansal,Incubate Fund India,
1580,Interviewbit,EdTech,Series A,200000000.0,Pune,Platform that provides coding and interview preparation course by industry professionals from tech companies,2020.0,Abhimanyu Saxena,"Tiger Global Management, Sequoia Capital India, Singapore’s Economic Development Board (EBD)",
1581,MoneyTap,FinTech,Series B,70185200.0,Delhi,App-based consumer credit line that gives customers access to credit on tap.,2020.0,"Bala Parthasarathy, Anuj Kacker, Kunal Varma","Aquiline Technology Growth (ATG), RTP Global, Sequoia India",
1582,Uniplatform Tech,SaaS,Seed,0.0,Delhi,Runs real estate SaaS platform MultiplyMyLeads.com.,2020.0,"Rohit Manghnani, Amit K Jaiswal, Iccha Manghnani","Frontline Strategy Finds, SucSEED Venture Partners LLP",
1583,INdwealth,FinTech,Series C,12000000.0,Gurugram,An Artificial Intelligence and Machine learning based wealth management platform,2020.0,Ashish Kashyap,"Tiger Global, Steadview Capital, DF International Private Partners",
1584,Bizongo,Advertising,Series C,30000000.0,Mumbai,A B2B marketplace for packaging materials,2020.0,"Sachin Agarwal, Aniket Deb, Ankit Tomar",Schroder Adveq,
1585,AppsFlyer,SaaS,Series D,210000000.0,Bengaluru,Mobile marketing analytics and attribution platform,2020.0,"Oren Kaniel, Reshef Mann",General Atlantic,
1586,Digit Insurance,Insurance,Seed,84000000.0,Bengaluru,General Insurance Company,2020.0,Kamesh Goyal,"A91 Partners, Faering Capital, TVS Capital",
1587,Livspace,Home Decor,Series D,60000000.0,Bengaluru,It offers end-to-end home design experience for homeowners and home designers,2020.0,"Anuj Srivastava, Ramakant Sharma, Shagufta Anurag","Tahoe Investment Group, Mercer Investment",
1588,GetVantage,FinTech,Seed,0.0,Mumbai,Revenue based finance provider,2020.0,Bhavik Vasa,"Samyakth Capital, Venture Catalysts",
1589,Konfinity,EdTech,Seed,0.0,Noida,Provides online coding courses,2020.0,"Navratn Singh, Kamal Pandey",Angel investors,
1590,Pine Labs,FinTech,Seed,0.0,Noida,Retail payment and hardware company,2020.0,"Lokvir Kapoor, Rajul Garg, Tarun Upaday",Mastercard,
1591,Instoried,SaaS,Seed,0.0,Delhi,Augmented writing platform which improves customer interest and engagement.,2020.0,Sharmin Ali,"SOSV, Chinaccelerator",
1592,Nupay,Financial Services,Seed,0.0,Haryana,"Integrated platform for Receivables and Payables automation, Electronic Invoicing, Reconciliations and Bank payouts",2020.0,"Neeraj Singh, Alok Arora",Venture Catalysts,
1593,LogiNext,Transportation,Series B,39000000.0,Delhi,"It helps logistics companies to improve internal operations, optimise delivery networks and provide customer service",2020.0,"Dhruvil Sanghvi, Manisha Raisinghani","Tiger Global, Steadview Capital",
1594,Samosa Singh,Catering,Series A,2700000.0,Bengaluru,Offers hygienic Indian Snacks,2020.0,"Shikhar Veer Singh, Nidhi Singh",She Capital,
1595,Crysta,Healthcare,Series A,1403400.0,Delhi,Offers diagnostic and screening services with regular counselling and clinical data management,2020.0,Seed,"Green Shots Capital, Alfa Ventures, Real Time Venture, Petrotech, Steel City Securities, Lalit Wadhwa, Dr Kriti Maroli",
1596,Eupheus Learning,EdTech,Series A,4300000.0,Delhi,"Provides technology-led, subscription-based learning solutions to schools",2020.0,"Sarvesh Shrivastava, Ved Prakash Khatri, Amit Kapoor",Yuj Ventures,
1597,Bounce,Automotive,Series D,105000000.0,Bengaluru,Offers a variety of bikes and scooters that can be rented on a subscription basis,2020.0,"Vivekananda Hallekere, Anil Giri Raju,Arun Agni","Accel Partners, B Capital",
1598,Park+,IT,Seed,11000000.0,Delhi,It is engaged in bringing digitization in parking,2020.0,Amit Lakhotia,"Sequoia Capital, Matrix Partners India",
1599,Goodmylk,Catering,Seed,400000.0,Bengaluru,Provides Vegan dairy products,2020.0,Abhay Rangan,"Ginni International, Elisa Khong, Sandeep Singh, VegInvest",
1600,SmartKarrot,SaaS,Seed,1000000.0,Delhi,It tracks customers’ real-time digital behaviour,2020.0,"Prithwi Dasgupta, Arnab Chatterjee",Angel investors,
1601,Skylo,IoT,Series B,103000000.0,Delhi,Provides affordable and ever present network that connects machines or sensors,2020.0,Trivedi,SoftBank Group,
1602,Tea Trunk,Catering,Seed,220000.0,Goa,Global premium tea brand,2020.0,"Snigdha Manchanda, Vikas Kumar, Aishwarya Malhi",Angel investors,
1603,Zoomcar,Transportation,Series D,30000000.0,Bengaluru,A car rental service platform,2020.0,"Greg Moran, David Back",Sony Innovation Fund,
1604,Mera Cashier,FinTech,Seed,250000.0,Noida,App meant for small and micro businessmen to manage their transactions digitally,2020.0,"Suneel Kumar, Sucharita Reddy, Gaurav Tomar, Akhilesh Nigam,","Amit Singal, Manish Aggarwal",
1605,Samya AI,SaaS,Seed,6000000.0,Delhi,Revenue growth AI startup in the consumer packed goods (CPG) space,2020.0,"Shailendra Singh, Deepinder Dhingra, Pavan Palety",Sequoia India,
1606,Kristal AI,AI,Series A,6000000.0,Delhi,Provides Algorithm-based financial services,2020.0,"Asheesh Chanda, Vineeth Narasimhan",Chiratae Ventures,
1607,Invento Robotics,AI,Seed,281300.0,Delhi,Known for Mitra Series of Robots,2020.0,"Balaji Viswanathan, Be Limitless Inc., Zingfin.com, NalandaU","Windrose Capital, ITI Growth Opportunities Venture Fund",
1608,Zimyo,Human Resources,Seed,0.0,Gurugram,Automates everyday HR processes with integrated solutions,2020.0,"Kumar Mayank, Ajay Kadyan",Yatra Angel Network (YAN),
1609,Sabse Sasta Dukaan,Healthcare,Seed,0.0,Kolkata,Online pharmacy dealing in medicines,2020.0,"Anish Agarwal, Anant Jain",Angel investors,
1610,Fitphilia,Healthcare,Seed,0.0,Mumbai,Provides IoT-enabled treadmill,2020.0,Nirav Patil,Angel investors,
1611,Medicus,Healthcare,Seed,12700.0,Mumbai,AI-based platform that explains and interprets blood tests and medical reports,2020.0,"Bhavesh Shah, Manav Shah",Angel investors,
1612,Monech,FinTech,Seed,12700.0,Mumbai,Automated platform which will help users to take their financial decisions,2020.0,Seed,Angel investors,
1613,Teach Us,EdTech,Seed,12700.0,Delhi,Educational portal which enables the students to access information related to education at one common platform,2020.0,Seed,Angel investors,
1614,Dealberg,E-Commerce,Seed,0.0,Bengaluru,Deals in office supplies,2020.0,Abhishek Emmanuel,Undisclosed,
1615,Phenom People,Human Resources,Series C,30000000.0,Delhi,It redefines the means to search for a job and recruit top talent,2020.0,Mahe Bayireddi,WestBridge Capital,
1616,Extra Edge,EdTech,Series A,700000.0,Pune,Admission Marketing Automation software for the education industry,2020.0,Kavita Dhillon,"Sprout Venture Partners, Indian Angel Network",
1617,Capital Quotient,FinTech,Seed,600000.0,Bengaluru,Investment advisor,2020.0,Sousthav Chakrabarty,Undisclosed,
1618,Karfa,E-Commerce,Seed,25000.0,Delhi,It sells products crafted by artisans,2020.0,Kartikeya Goel,Undisclosed,
1619,Gamerji,Gaming,Seed,400000.0,Delhi,Esports tournament platform,2020.0,"Soham Thacker, Varun Gajjar",La Gajjar Group,
1620,Bounce,Automotive,Series D,97500000.0,Bengaluru,Offers a variety of bikes and scooters that can be rented on a subscription basis,2020.0,"Vivekananda Hallekere, Anil Giri Raju,Arun Agni","Accel Partners, B Capital",
1621,Zinier,Automotive,Series C,90000000.0,Bengaluru,Provides intelligent field service automation,2020.0,Arka Dhar,ICONIQ Capital,
1622,ProEves,Child Care,Seed,507000.0,Delhi,"Provides tech-enabled, end-to-end childcare support solutions for corporate and retail consumers",2020.0,"Divya Agarwal, Ketika Kapoor",1Crowd,
1623,Toddle,Unknown,Seed,1440000.0,Bengaluru,Collaboration and productivity platform for teachers across the world,2020.0,"Deepanshu Arora, Parita Parekh",Matrix Partners India,
1624,Aesthetic Nutrition,Healthcare,Series A,0.0,Delhi,Markets and sells chewable dietary supplements,2020.0,Divij Bajaj,DSG Consumer Partners,
1625,Capital Float,FinTech,Seed,15000000.0,Bengaluru,Digital lending,2020.0,"Gaurav Hinduja, Sashank Rishyasringa","Sequoia Capital, Ribbit Capital, Amazon, Saif Partners",
1626,Ninjacart,AgTech,Series C,10000000.0,Bengaluru,Online grocery delivery platform,2020.0,"Thirukumaran Nagarajan, Sharath Loganathan, Sachin Jose, Kartheeswaran KK, Vasudevan Chinnathambi","Flipkart India, Singapore-based GEC3",
1627,TechnifyBiz,AgTech,Seed,2000000.0,Delhi,Online marketplace for non-perishable food items,2020.0,"Akash Sharma, Abhishek Agarwal","Omnivore, Insitor Impact Asia Fund",
1628,Wysh,Digital Media,Series A,2000000.0,Hyderabad,Celebrity engagement and wishing platform,2020.0,"Mahesh Gogineni, Varun MS, Manan Maheshwari",Kalaari Capital,
1629,Keito,AI,Seed,160000.0,Pune,Enterprise productivity startup,2020.0,Amal PS,Suma Soft Pvt Ltd,
1630,Klub,FinTech,Seed,2000000.0,Delhi,Provides growth financing to high-affinity brands,2020.0,"Anurakt Jain, Ishita Verma",Sequoia Surge,
1631,Aadhar,E-Commerce,Seed,0.0,Mumbai,Ayurveda wellness and lifestyle consumer brand,2020.0,Seed,"Sprout Venture Partners, JITO Angel Network, LetsVenture",
1632,IncubateHub,IT,Seed,0.0,Bengaluru,Provides platform for Corporates to connect establish brand presence among innovation community,2020.0,Rajiv Mukherjee,Venture Catalysts,
1633,Rage Coffee,Legal,Seed,0.0,Delhi,Provides effective Instant Coffee Infused with Natural Brain Vitamins & Plant Based Cognitive Enhancers,2020.0,Bharat Sethi,Refex Capital,
1634,Skilancer,IT,Seed,0.0,Noida,Solar module cleaning system [MCS] providers,2020.0,Neeraj Kumar,Venture Catalysts,
1635,Harappa Education,EdTech,Seed,0.0,Delhi,Provides online courses on foundational skills,2020.0,Pramath Raj Sinha,James Murdoch-led Lupa Systems,
1636,Rheo,Media and Entertainment,Seed,2000000.0,Delhi,Online e-sports streaming and community platform,2020.0,Gaurav Munjal,"Lightspeed Venture Partners, Sequoia Surge",
1637,Axio Biosolutions,Healthcare,Series B,5200000.0,Bengaluru,Medical device manufacturer,2020.0,Leo Mavely,Omidyar Network India,
1638,Techbooze,Creative Agency,Series A,15000000.0,Delhi,"Business Development, Consulting and Funding facilitator for Startups Enterprise",2020.0,Mr. Subhashis Kar,Space Capital,
1639,PayMart,FinTech,Seed,0.0,Chandigarh,Provides cardless cash withdrawals through small merchants shops,2020.0,Amit Narang,"IIM Ahmedabad’s incubator (CIIE.CO),Chandigarh Angels Network",
1640,Testbook,EdTech,Series B,8400000.0,Delhi,Helps students prepare online for competitive exams,2020.0,"Praveen Agrawal, Yadvendar Champawat, Manoj Munna, Abhishek Sagar, Ashutosh Kumar, Narendra Agrawal",Iron Pillar,
1641,FabAlley,E-Commerce,Seed,1100000.0,Noida,Online fashion store,2020.0,"Tanvi Malik, Shivani Poddar.",Trifecta Capital,
1642,HaikuJAM,Unknown,Seed,3400000.0,Delhi,Creative writing mobile platform,2020.0,Neer Sharma,"Lightbox. Social Capital, Dunce Capital",
1643,Mamaearth,E-Commerce,Series A,18300000.0,Delhi,Online baby and mother care brand,2020.0,"Ghazal Alagh, Varun Alagh",Sequoia India,
1644,Rentomojo,Facilities Support Services,Seed,2000000.0,Delhi,"Furniture, electronics, and appliance-centric consumer leasing platform",2020.0,Geetansh Bamania,GMO Payment Gateway,
1645,Zomato,Catering,Seed,150000000.0,Delhi,Online food delivery and restaurant discovery platform,2020.0,Deepinder Goyal,Ant Financial,
1646,Byju,EdTech,Seed,200000000.0,Delhi,Provides online learning classes,2020.0,Byju Raveendran,Tiger Global,
1647,Generico,Healthcare,Seed,1400000.0,Mumbai,Generic medicine focussed retail chain,2020.0,Siddharth Gadia,Alteria Capital,
