,Company/Brand,Sector,Stage,Amount($),HeadQuarter,What it does,Founded,Founders,Investor,Unnamed: 9
795,Mitron TV,Media and Entertainment,Seed,0.0,Bengaluru,Mitron is a free short videoplatform for next generation,2020.0,"Shivank Agarwal, Anish Khandelwal",9Unicorns,
796,Svami,Catering,Seed,800000.0,Mumbai,Svami is the result of three seasoned drinkers extending their love for libations to the larger world of drinks.,2020.0,Sahil Jatana,"Niren Shah, Rukam Capital Trust",
797,Dhurnia,EdTech,Seed,100000.0,Dhingsara,Developer of an online learning platform intended for various competitive exam preparations.,2020.0,"Ajay Kumar, Murari Singh","Chandigarh Angels Network, Modulor Capital",
798,Expertrons,EdTech,Seed,0.0,Mumbai,Expertrons is an AI video bot platform created to help students and professionals prepare for interviews.,2020.0,Jatin Solanki,"Rohit Chanana, Sukanta Ganguly",
799,Leena AI,AI,Seed,8000000.0,New York,Leena AI offers a human resource management platform that transforms employee experience with conversational AI.,2020.0,"Adit Jain, Anand Prajapati, Mayank Goyal","Alan Patricof, Jim Moffatt",
800,Bizlog,Logistics,Seed,1000000.0,Bengaluru,Bizlog Value Chain enables re-commerce and circular economy through unique REVERSE LOGISTICS engine.,2020.0,"HS Srinivasan, Krishnan Rajan, E.V. Shunmugam",IAN Fund,
801,Tamasha.live,Gaming,Seed,300000.0,Mumbai,"Tamasha offers a platform for influencers to host live, video based, real money contests and games.",2020.0,"Saurabh Gupta, Siddharth Swarnkar","9Unicorns, Titan Capital, FirstCheque",
802,Fedo,AI,Seed,1000000.0,Bengaluru,Artificial Intelligence based Credit Score for Health,2020.0,"Arun Mallavarapu, Prasanth Madavana",AIM Smart City,
803,FabHotels,Hospitality,Seed,1000000.0,Gurugram,Fabhotels is the online aggregator for hotel rooms. It aims to provide standardized services at economical budgets.,2020.0,"Adarsh Manpuria, Vaibhav Aggarwal","RB Investments Pte. Ltd, Goldman Sachs",
804,Freshokartz,AgTech,Series A,1000000.0,Jaipur,"Freshokartz provides soil data based crop and fertilisers recommendation to farmers and delivery seeds, pesticides",2020.0,"Chandrakanta, Rajendra Lora","Rajasthan Venture Capital Fund, Innovana Thinklabs",
805,FlexiLoans,FinTech,Seed,6000000.0,Mumbai,"an online lending platform started with an endeavour to solve the problem that SMEs face in accessing Quick, Flexible and Adequate funds for growing their Businesses.",2020.0,"Abhishek Kothari, Deepak Jain, Manish Lunia, Ritesh Jain",>Vikram Sud,
806,Agrix,AgTech,Seed,0.0,Patna,"Farming-as-a-service (covering farm machinery and agri input services) and provides market linkages, especially for fragmented farm owners.",2020.0,"Nilay Pandey, Saurav Singh, Vivek Kumar",Maple Capital Advisors,
807,BharatAgri,AgTech,Series A,0.0,Pune,A Smart Farming Technology Platform for Indian Farmers,2020.0,"Siddharth Dialani, Sai Gole","021 Capital, India Quotient",
808,FreshtoHome,E-Commerce,Series C,121000000.0,Bengaluru,Freshtohome is an e-commerce platform for fresh and chemical-free seafood.,2020.0,Shan Kadavil,"Ascent Capital, Iron Pillar",
809,Credable,FinTech,Seed,4500000.0,Mumbai,CredAble provides working capital & supply chain finance programs for large enterprises and their suppliers and distributors.,2020.0,Nirav Choksi,Oaks Asset Management,
810,Railofy,Transportation,Seed,5000000.0,Mumbai,Railofy is a WL & RAC protection that enables waitlisted passengers to reach their destination at the lowest possible price.,2020.0,"Rohan Dedhia, Vaibhav Saraf, Hrishabh Sanghvi","Roots Ventures, Better Capital",
811,Finova Capital,FinTech,Seed,55000000.0,Jaipur,Finova Capital is a non-banking financial company.,2020.0,"Mohit Sahney, Sunita Sahney","Sequoia Capital India, Faering Capital",
812,Teachmint,EdTech,Seed,3500000.0,Bengaluru,Teachmint is an easy to use platform for tutors to conduct unlimited live classes and manage their classrooms,2020.0,"Mihir, Payoj Jain, Divyansh Bordia, Anshuman Kumar",Lightspeed India,
813,Peel-Works,E-Commerce,Seed,3000000.0,Mumbai,Peel-Works is a tech and data analytics company specializing in e-commerce for corner stores.,2020.0,"Sachin Chhabra, Nidhi Ramachandran","CESC Ventures, Brun Raschle",
814,Janani,Healthcare,Seed,200000.0,Bengaluru,Janani aims to make the process of infertility treatment and assisted fertilisation easier,2020.0,Nilay Mehrotra,9Unicorns,
815,Credgenics,FinTech,Seed,3300000.0,Gurugram,"Credgenics is a tech-enabled platform backed by Titan Capital, helping fintech lenders and Banks in their critical NPA reduction",2020.0,"Anand Agrawal, Mayank Khera, Rishabh Goel","Accel, Sunder Nookala",
816,Finelistings,Automotive,Seed,0.0,Delhi,A Used Luxury Car Marketplace,2020.0,Aneesh Mathur,Justdial,
817,Wellversed,Healthcare,Series A,0.0,Delhi,Wellversed Health enables production of customised clinical food products specific to health requirements of a demography or an individual.,2020.0,"Aanan Khurma, Aditya Seth, Ripunjay Chachan","KLUB Works, Shankar Narayanan",
818,Jumbotail,E-Commerce,Series B,11000000.0,Bengaluru,"Jumbotail is solving an important problem of organising food and grocery ecosystem in India through technology, data science and design.",2020.0,"Ashish Jhina, Karthik Venkateswaran",Nexus Venture Partners and 23 High Networth Individuals (HNIs),
819,Winzo,Gaming,Seed,2000000.0,Delhi,WinZO is a mobile e-sports social gaming platform that offers monetary benefits and prizes to players.,2020.0,"Paavan Nanda, Saumya Singh Rathore","Makers Fund, Courtside Ventures",
820,mCaffeine,Cosmetics,Series B,5000000.0,Mumbai,"MCaffeine is a personal care brand that offers caffein-infused face, body, and hair care products.",2020.0,"Tarun Sharma, Vikas Lachhwani","RPSG Ventures, Amicus Capital",
821,Pocket FM,Media and Entertainment,Series A,5000000.0,Bengaluru,Pocket FM is an audiobook & podcast app that brings you over 10K+ popular audiobooks.,2020.0,Rohan Nayak,"Times Group, Lightspeed",
822,Snackible,Healthcare,Seed,0.0,Mumbai,Snackible operates a health-food production company designed to sell healthy snack food via online and offline channels.,2020.0,Seed,"Mumbai Angels, Murali Nair",
823,FreshtoHome,E-Commerce,Seed,16000000.0,Bengaluru,Freshtohome is an e-commerce platform for fresh and chemical-free seafood.,2020.0,Shan Kadavil,"Ascent Capital, Iron Pillar",
824,Jumbotail,Business Development,Series B,11000000.0,Bengaluru,Jumbotail is solving an important problem of organising food and grocery ecosystem in India,2020.0,"Ashish Jhina, Karthik Venkateswaran","Nexus Venture Partners, Capria Ventures",
825,Nykaa,E-Commerce,Seed,0.0,Mumbai,Nykaa is an online marketplace for different beauty and wellness products.,2020.0,Falguni Nayar,"Katrina Kaif, Steadview Capital",
826,TagZ Foods,Catering,Seed,0.0,Bengaluru,TagZ Foods is a supplier of snacks and food products.,2020.0,"Sagar Bhalotia, Anish Basu Roy","Exfinity Venture Partners, Shesh Kondi",
827,Genius Teacher,EdTech,Seed,2000000.0,Mumbai,"Genius Teacher creates engaging educational content, delivers fun learning experience to the students",2020.0,"Advitiya Sharma, Gaurav Lahoti","Sandeep Tandon, Daniel Lapus",
828,Krimanshi Feeds,Healthcare,Seed,500000.0,Jodhpur,Krimanshi aims to increase rural income by improving the productivity of Indian cattle with better quality feed.,2020.0,Nikhil Bohra,"Rajasthan Venture Capital Fund, AIM Smart City",
829,Origo,AgTech,Seed,4000000.0,Gurugram,Provider of marketing and warehousing services for agricultural commodities.,2020.0,"Sunoor Kaul,",Northern Arc Capital,
830,GetVantage,FinTech,Seed,5000000.0,Mumbai,GetVantage is India and Southeast Asia's first fintech enabled Revenue-based financing platform.,2020.0,"Amit Srivastava, Bhavik Vasa, Sachin Tagra, Sachin Tagra","Samyakth Capital, Venture Catalysts",
831,Betterplace,IT,Series B,10000000.0,Bengaluru,Developer of a digital verification platform designed to manage the semi-formal workforce.,2020.0,"Saurabh Tandan, Pravin Agarwala",Jungle Ventures,
832,Biddano,Healthcare,Series A,600000.0,Mumbai,India's 1st tech-enabled healthcare logistics platform.,2020.0,Talha Shaikh,Windrose Capital,
833,InVideo,Media and Entertainment,Series A,15000000.0,Mumbai,InVideo enables you to transform your content into great videos.,2020.0,"Harsh Vakharia, Pankit Chheda, Sanket Shah","Base Partners, Sequoia Capital India",
834,Arzooo,Business Development,Series A,7500000.0,Bengaluru,"Retail tech platform empowering 300,000+ small retailers in electronics space to compete with big organised players and increase sales",2020.0,"Khushnud Khan, Rishi Raj Rathore","3Lines, Jabbar Internet Group",
835,Hubilo,IT,Seed,4500000.0,San Francisco,World’s smartest virtual event platform that brings Experience & Intelligence together,2020.0,"Mayank Agarwal, Vaibhav Jain","Nishant Rao, Jonathan Boutelle",
836,BASIC Home Loan,FinTech,Seed,5000000.0,Gurugram,"A platform for automating home loans for middle and low-income households in India,",2020.0,Atul Monga,Picus Capital,
837,Ketos,AI,Seed,18000000.0,San Francisco,KETOS provides hardware and software analytics solutions and real-time data for usage and flow across water systems.,2020.0,Meena Sankaran,"Citi Ventures, Illuminated Funds Group",
838,SUGAR cosmetics,Cosmetics,Seed,2000000.0,Mumbai,It is a cruelty-free makeup brand providing cosmetics that is high on style and higher on performance.,2020.0,"Kasuhik Mukherjee, Vineeta Singh","A91 Partners, RB Investments Pte. Ltd",
839,Signzy,FinTech,Seed,5400000.0,Bengaluru,It is creating 'building blocks for a Digital Trust system.,2020.0,"Ankit Ratan, Ankur Pandey, Arpit Ratan","GenNext Ventures, Contrarian Drishti Partners",
840,Ahaguru,EdTech,Series A,0.0,Chennai,"It is conducting IIT JEE Coach for Physics, Math and Chemistry easily.",2020.0,"Gomathi S, Dr Balaji Sampath",Anand Mahindra,
841,Tekion,AI,Series C,150000000.0,San Ramon,It is a cloud-built platform with advanced machine learning and AI capabilities for a personalized and seamless consumer experience.,2020.0,"Guru Sankararaman, Jay Vijayan","Alliance Ventures, Storm Ventures",
842,Brighteye Ventures,EdTech,Seed,5400000.0,Paris,Education technology venture capital firm.,2020.0,David guerin,Tandem,
843,EzeRx,Healthcare,Seed,200000.0,Kolkata,Developer and manufacturer of medical devices,2020.0,"Amit mandahar, Chaitali roy","Indian Oil Corporation, Krishna Chakravarty",
844,VitalTech,Healthcare,Seed,3000000.0,Plano,"VitalTech is a develop technologies that empower patients to better care for their safety,",2020.0,Anjan Panneer Selvam,Tech Mahindra,
845,Genius Teacher,EdTech,Seed,2000000.0,Mumbai,"Genius Teacher creates engaging educational content, delivers fun learning experience to the students",2020.0,"Advitiya Sharma, Gaurav Lahoti","Whiteboard Capital, VKG Ventures LLP.",
846,Ultraviolette Automotive,Automotive,Series B,4000000.0,Bengaluru,Ultraviolette Automotive is a technology startup working on electric two-wheelers and energy infrastructure.,2020.0,"Narayan Subramaniam, Niraj Rajmohan",TVS Motor Company,
847,Tring,Digital Media,Seed,1440000.0,Mumbai,"Tring is a celebrity engagement platform, for all occasions including birthday, anniversaries, get well soon messages.",2020.0,"Akshay Saini, Rahul Saini, Pranav Chabhadia","Sujeet Kumar, Hemesh Singh",
848,Rare Planet,Business Development,Series A,400000.0,Kolkata,Rare Planet sells handicrafts made by local artisans.,2020.0,"Ranodeep Saha, Vijay Kumar",Venture Catalysts,
849,GoodGamer,Gaming,Seed,2500000.0,Bengaluru,GoodGamer is India's first Daily Fantasy Sports and true Esports gaming platform.,2020.0,Charles Creighton,Unknown,
850,InnAccel,Healthcare,Series A,1500000.0,Bengaluru,"A building a portfolio of novel medical devices designed, engineered, and priced for global Emerging Markets.",2020.0,Siraj Dhanani,Mount Judi Ventures,
851,Tiliter,Business Development,Seed,7500000.0,Sydney,Software that uses computer vision to recognise products without barcodes,2020.0,"Chris Sampson, Marcel Herz, Martin Karafilis","AngelList, Investec",
852,Slintel,Advertising,Seed,4200000.0,San Francisco Bay Area,"Slintel, a leader in capturing technographics-powered buying intent, helps companies uncover the 3% of active buyers in their target market.",2020.0,"Deepak Anchala, Rahul Bhattacharya, Ranjana TN","Accel, Stellaris Venture Partners",
853,SoOLEGAL,Legal,Seed,4000000.0,Delhi,"SoOLEGAL is a global integrated directory of lawyers, legal aid organizations, and Law firms.",2020.0,Manish Kaul,Unknown,
854,HobSpace,EdTech,Seed,200000.0,Mumbai,India's Activity Hub for Kids,2020.0,"Priya Goel Sheth, Harsh Jain",Artha Venture,
855,Supplynote,Saas,Seed,500000.0,Noida,Supplynote is India's leading procurement platform with a unique stack of SAAS and E-commerce to solve the procurement problem,2020.0,"Abhishek Verma, Harshit Mittal, Kumar Kushang, Nitin Prakash","MOX, SOSV",
856,Hire Me Car,Automotive,Seed,0.0,Noida,India's largest cloud based digital discovery and services provisioning platform for the taxi rental,2020.0,Pankaj Sharma,Unknown,
857,ShopUp,E-Commerce,Series A,22000000.0,Bangladesh,"ShopUp provides easy access to B2B sourcing, last-mile logistics, digital credit, and business management solutions to small businesses.",2020.0,"Afeef Zaman, Ataur Rahim Chowdhury, Siffat Sarwar","Flourish Ventures, Lonsdale Capital",
858,Harmonizer India,IT,Seed,0.0,Bengaluru,"Energy-efficient solutions based on the Artificial Intelligence, Machine Learning and Internet of Things technology,",2020.0,M R Srinivas,Kapil Dev,
859,Zomato,Catering,Seed,52000000.0,Gurugram,Zomato is a food delivery and restaurant discovery site that provides information and reviews about restaurants.,2020.0,"Deepinder Goyal, Gaurav Gupta, Pankaj Chaddah","Kora, Tiger Global Management",
860,Dukaan,IT,Seed,6000000.0,Mumbai,Developer of an android application designed for businesses to sell online.,2020.0,"Subhash Choudhary, Suumit Shah","Lightspeed, Matrix Partners.",
861,CredR,Automotive,Seed,2000000.0,Mumbai,India’s Only 100% Inspected and Certified Used Bikes Marketplace.,2020.0,"Nikhil Jain, Nittin Mittal, Sumit Chhazed","Eight Roads Ventures, On Mauritius",
862,Satyukt,AgTech,Seed,500000.0,Bengaluru,An agritech company that provides business to business (B2B) agricultural data,2020.0,"Sat Tomer, Yukti Gill","NABVENTURES, Social Alpha (India)",
863,RACEnergy,Automotive,Seed,0.0,Hyderabad,RACEnergy builds and deploys battery swapping infrastructure for use in various segments of vehicles.,2020.0,"Arun Sreyas, Gautham Maheswaran","growX Ventures, Huddle (Incubator)",
864,TREAD,Fitness,Seed,1100000.0,Bengaluru,A homegrown fitness startup that aims to advance the 'Fit India' initiative by offering holistic and affordable workouts.,2020.0,Dinesh Godara,"Better Capital, Kunal Shah, Gaurav Munjal",
865,Anveshan,Catering,Seed,100000.0,Bengaluru,Provide quality and healthy food products,2020.0,"Aayushi Khandelwal, Akhil Kansal, Kuldeep Parewa",Titan Capital,
866,TeaMonk,Catering,Series A,900000.0,Bengaluru,India's Finest Specialty Tea company.,2020.0,"Amit Dutta, Ashok Mittal","Lead Angels Network, Roots Ventures",
867,Fleetx,IT,Series B,3000000.0,Gurugram,"Fleetx is an intelligent data platform which uses AI, machine learning, sensors and predictive analytics to help fleet owners.",2020.0,"Abhay Jeet Gupta, Parveen Kataria, Udbhav Rai, Vineet Sharma, Vishal Mishra","Rohit Bansal, Rohan Ranavat",
868,ReNEWate,Real Estate,Seed,0.0,Pune,"Tech platform helping millions of renovation contractors, property improvement professionals and businesses manage their business digitally.",2020.0,Supratik Ghatak,Real Estate Accelerator Program,
869,Tango Eye,Saas,Seed,0.0,Chennai,Retail Video Analytics SaaS product,2020.0,Surender Gounder,"Riso Investments, Lenskart",
870,Rare Planet,Business Development,Series A,0.0,Kolkata,Rare Planet sells handicrafts made by local artisans.,2020.0,"Ranodeep Saha, Vijay Kumar",Venture Catalysts,
871,Avataa Me,IT,Series A,7000000.0,Bengaluru,AVATAAR.ME is a deep-tech 3D AR platform which delivers personalized fashion discovery experience to users on mobile devices.,2020.0,Gaurav Baid,Sequoia Capital India,
872,Arrival,Environmental Consulting,Seed,118000000.0,London,Arrival is a technology company that specializes in developing electric vehicles.,2020.0,Denis Sverdlov,"UPS Ventures, Hyundai Motor Company",
873,Cover Genius,FinTech,Seed,15000000.0,Sydney,Cover Genius provides an insurance distribution platform designed to protect the customers of e-commerce companies,2020.0,"Angus McDonald, Chris Bayley","King River Capital, Leap Capital",
874,Phononic Vibes,AI,Seed,2300000.0,Milano,"Phononic Vibes introduces a new patented technology for vibration and noise control and isolation, with a circular economy approach.",2020.0,"Andrea Boeri, Braghin Francesco, Giovanni Capellari, Luca D'Alessandro, Stefano Caverni",Unknown,
875,MikeLegal,Legal,Seed,0.0,Gurugram,MikeLegal is an AI powered legal associate that aims to build an ecosystem of legal tools,2020.0,"Tushar Bhargava, Anshul Gupta","SOSV, Artesian",
876,Clair,FinTech,Seed,4500000.0,New York,Clair is a social fintech that provides Instant Pay Access as a Service for human capital management and gig platforms.,2020.0,"Alex Kostecki, Erich Nussbaumer, Nico Simko","Upfront Ventures, Walkabout Ventures",
877,Gourmet Garden,Consumer Goods,Seed,0.0,Palmwoods,Gourmet Garden is a global market leader in chilled convenient packaged herbs.,2020.0,Arjun Balaji,Advent Partners,
878,Miko,AI,Series B,3000000.0,Mumbai,"Miko is an advanced robotics startup founded by three IIT Bombay post-graduates on the pillars of robotics, AI & IoT.",2020.0,"Chintan Raikar, Prashant Iyengar, Sneh Vaswani","Stride Ventures, YourNest Venture Capital",
879,Razorpay,FinTech,Series D,100000000.0,Bengaluru,"Razorpay is a platform that enables businesses to accept, process, and disburse payments.",2020.0,"Harshil Mathur, Shashank Kumar","Tiger Global Management, Sequoia Capital India",
880,Ninjacart,Catering,Seed,30000000.0,Bengaluru,"Ninjacart is a business-to-business fresh produce supply chain that connects farmers, manufactures, and brands to retailers directly.",2020.0,"Ashutosh Vikram, Kartheeswaran K K, Sharath Loganathan, Thiru Nagarajan, Thirukumaran Nagarajan, Vasu Devan","Syngenta Ventures, Walmart",
881,Wow! Momo,Catering,Seed,5000000.0,Kolkata,Wow! Momo is a chain of fast-food restaurants that specializes in momos.,2020.0,"Binod Kumar Homagai, Sagar Daryani, Shah Miftaur Rahman","Tiger Global Management, William Bissell",
882,Pepper Content,Creative Agency,Series A,4200000.0,Mumbai,Pepper Content is a Content-Mediation Platform that connects talented writers to organisations that require content.,2020.0,"Anirudh Singla, Rishabh Shekhar","Alok Mittal, Manan Maheshwari",
883,LIVSPACE,Home Decor,Seed,4000000.0,Bengaluru,"Livspace is an interior design startup that offers a platform that connects people to designers, services, and products.",2020.0,"Anuj Srivastava, Ramakant Sharma, Shagufta Anurag","Mercer Investments, Bessemer Venture Partners",
884,Acculi Labs,Healthcare,Seed,600000.0,Bengaluru,Acculi Labs is a clinical grade smartphone based diagnostic tool,2020.0,"HariPrasath M., Rupam Das",Startup Basket.,
885,Your MD,Healthcare,Seed,25000000.0,London,Your.MD is a platform committed to helping a billion people find their health by unlocking self-care with digital technology.,2020.0,"Alessandro Traverso, Birger Lie, Harald Jellum, Matteo Berlucchi","Orkla Ventures, Smedvig Capital",
886,Antaios,IT,Seed,11000000.0,France,Developer of memory-based technology intended to solve issues of advanced computing.,2020.0,Jean Pierre Nozieres,Unknown,
887,Unnati,AgTech,Series A,1700000.0,Noida,A helping hand to the farming community through Artificial Intelligence,2020.0,"Amit Sinha, Ashok Prasad",NABVENTURES,
888,Disprz,EdTech,Series B,1600000.0,Chennai,"Disprz is a one-of-its-kind “knowledge-tech” start-up that strives to make people knowledgeable, productive and smarter at what they do.",2020.0,"Kuljit Chadha, Subramanian Viswanathan","Xseed Partners, InnoVen Capital",
889,Uni,FinTech,Seed,18500000.0,Mumbai,The team aims to bridge the gap for credit cards and make them more accessible for people across different regions.,2020.0,Nitin Gupta,"Lightspeed India Partners, Accel India",
890,Credit Wise Capital,FinTech,Seed,6000000.0,Mumbai,CreditWise Capital is a consumer finance company.,2020.0,"Hirak Joshi, Aalesh Avlani",Venture Catalysts,
891,Chargebee,Saas,Series F,55000000.0,San Francisco Bay Area,Chargebee is a PCI Level 1 certified subscription and recurring billing system for SaaS and subscription based eCommerce businesses,2020.0,"KP Saravanan, Krish Subramanian, Rajaraman Santhanam, Thiyagarajan T","Accel, Steadview Capital",
892,Reliance Retail Ventures Ltd,Business Development,Seed,70000001024.0,Mumbai,"Reliance Retail offers online shopping and a chain of neighborhood stores, supermarkets, and wholesale/specialty stores.",2020.0,Mukesh Ambani,"Silver Lake, Mubadala Investment Company",
893,Winuall,EdTech,Seed,2000000.0,Bengaluru,"Winuall specializes in the fields of E-learning, online quizzes, and tests, study material for competitive exams.",2020.0,"Ashwini Purohit, MS Chouhan","Amit Lakhotia, Akash Gehani",
894,Genrobotics,AI,Seed,300000.0,Trivandrum,GenRobotic specializes in powered robotic exoskeletons with RC controlled humanoid robotic systems and Artificial Intelligence.,2020.0,"Arun George, Nikhil NP, Rashid Bin Abdulla, Vimal Govind MK",Unicorn India Ventures,
895,Livve,Facilities Support Services,Seed,1500000.0,Cochin,An online platform where both owners and tenants find help in making sure their rental transaction are safe and secure.,2020.0,Maya Lakshman,Unknown,
896,Ergos,AgTech,Series A,5000000.0,Samastipur,Ergos is building an integrated supply chain by setting up micro warehouses.,2020.0,"Kishor Kumar Jha, Praveen Kumar","Aavishkaar Venture Capital, Chiratae Ventures",
897,Krishitantra,Agriculture,Seed,1000000.0,Hyderabad,Krishi-Tantra is an Agri-IoT startup building farm automation for controlled agricultural environment.,2020.0,"Sandeep Kondaji, Vishnuprasada Bhat, Anand Bellan Raman","NABVENTURES, Omnivore",
898,PakkaProfile,Human Resources,Seed,0.0,Bengaluru,"PakkaProfile bridges the gap between companies and the workforce by making better, unbiased decisions with the help of psychometric games",2020.0,"Nagmanjunath Shivakumar, Savio Sebastian",Java Capital,
899,Monet Networks,AI,Seed,500000.0,Irvine,Monet Networks Using sentiment and non verbal cues analysis for increased engagement and real time content feedback.,2020.0,Anurag Bist,"SenseAI Ventures, EvoNexus",
900,Unocoin,FinTech,Series A,0.0,Tumkur,"Unocoin is an Indian bitcoin processor that enables users to buy, sell, store, use, and accept bitcoins.",2020.0,"Abhinand Kaseti, Harish B V, Sathvik Vishwanath, Sunny Ray","Digital Finance Group, FundersClub",
901,Pesto,EdTech,Seed,0.0,Delhi,Pesto is a career accelerator for software engineers with the mission to take opportunities to places where talent exists.,2020.0,"Andrew Linfoot, Ayush Jaiswal","Sriharsha Majety, Rahul Jaimini",
902,NirogStreet,IT,Series A,2000000.0,Gurugram,NirogStreet is an Ayurvedic doctor discovery and appointment booking platform where patients can easily find doctors and fix consultation.,2020.0,Ram N Kumar,"Wavemaker Partners, Subho Ray",
903,Bambrew,Logistics,Seed,0.0,Bengaluru,Bambrew is an online shop for reusable bamboo straws.,2020.0,Vaibhav Anant,Upsparks,
904,Omnify,Saas,Series A,0.0,San Francisco Bay Area,Omnify is a Global SaaS platform for Small Services Business,2020.0,"Kabandi Saika, Manik Mehta","Saurabh Arora, LD Sharma",
905,Fanball XI,Gaming,Seed,1000000.0,Delhi,The gaming company mostly focused on fantasy football games,2020.0,Vinayak Seth,Foxhog Ventures,
906,Treebo Hotels,Hospitality,Seed,6000000.0,Bengaluru,"Treebo is India's tech-enabled, asset-light affordable accommodation brand.",2020.0,"Kadam Jeet Jain, Rahul Chaudhary, Sidharth Gupta","Ramesh Mangaleswaran, Saikiran Krishnamurthy",
907,GPS Renewables,CleanTech,Series A,3000000.0,Bengaluru,To solve the urban waste problem by utilising local technologies and business models.,2020.0,"Mainak, Sreekrishna","Triodos, Caspian",
908,Public,Digital Media,Seed,30000000.0,Delhi,Video-led social app Public provides users with a platform to share and view important hyperlocal videos,2020.0,Azhar Iqubal,"Lee Fixel's Addition, SIG Global, Tanglin Venture Partners",
909,Legal Salah,Legal,Seed,1000000.0,Kolkata,Legal Salah is bringing the provision of imparting value based legal and consultancy services to the user.,2020.0,CA Abhinit Singh,I2I Capitals,
910,FanPlay,Gaming,Seed,0.0,Delhi,FanPlay Technologies operates as a real-money gaming startup.,2020.0,"Bharat Gupta, Pritesh Kumar","Core91 Fund, Anupam Mittal",
911,ECOSTP,CleanTech,Seed,19000000.0,Bengaluru,Eco friendly zero power zero maintenance sewage treatment plant in India.,2020.0,"Simar Kohli, Tharun Kumar, Praseed KK",Terwilliger Centre,
912,Coralogix,Saas,Series B,25000000.0,San Francisco,Coralogix is a log analytics SaaS platform that improves the delivery and maintenance process for software providers.,2020.0,"Ariel Assaraf, Guy Kroupp, Lior Redlus, Yoni Farin","2B Angels, Janvest Capital Partners",
913,Equiwatt,IT,Seed,300000.0,Newcastle Upon Tyne,Equiwatt is a digital platform enabling households to get paid for saving energy at peak times.,2020.0,"Johnson Fernandes, Ravneet Kaur",Rising Stars,
914,Reliance Retail Ventures,E-Commerce,Seed,800000000.0,Mumbai,"Reliance Retail offers online shopping and a chain of neighborhood stores, supermarkets, and wholesale/specialty stores.",2020.0,Mukesh Ambani,"General Atlantic, Kohlberg Kravis Roberts",
915,Zhangmen,EdTech,Seed,400000000.0,Shanghai,Zhangmen is an online tutoring platform provides tutoring courses to students.,2020.0,Yi Zhang,"CICC Alpha, VMS Asset Management",
